2022-02-27	553810	Roni Wiener	Roni on CF with Housing Colony with Menaka	Roni coaches Menaka one-on-one on 4th Sundays of the month to facilitate CF at the Housing Colony she lives in. Note, Scheduled call can cancel,change depending on Roni and Menaka's needs so please check the website schedule before joining the call.	MbRRMp-9yDk	roni,challenge_based
2022-03-15	553650	Magda Baranska	The power of reflecting back and curiosity 	The CF facilitation is a process of discovery of what’s important for a group and how this can be attended to. Curiosity and reflecting back support me in this discovery. You are invited to explore together in what ways it could be supportive for you and what are the ways you would like to express your curiosity and reflect back what you heard.  Note, English is Magda's second language and sometimes it is a stretch for her to express herself precisely and understand others instantly. Making it visible helps Magda to relax. (for CF Newsletter and Cf Website)	KHX8Z9uE8FE	magda
2022-04-10	553390	Roni Wiener	Roni coaching Michael on applying CF while mediating 	Roni coaches Michael one-on-one on sharing CF while mediating a dispute between a US Government employee and his management. 	zniE7uROK2k	roni
2022-04-20	553290	Verene Nicolas	Engaging with Dissent	Facilitation is an art and requires reading the room very quickly and in detail. This is especially true when it comes to dissent, because often people feel either vulnerable or agitated while sharing a different perspective or concerns. In this session we will practice what it would be like to follow your intuition and how to follow it while facilitating. Please bring your own situation(s) so we can work with real life examples.	Unadg3vqanQ	verene,dissent
2022-04-24	553250	Roni Wiener	One-on-one CF Coaching 	One-on-one CF Coaching on real-group scenarios brought by participants that they are needing coaching to share CF in their communities.	uYFJYzcBngY	roni
2022-06-15	552730	Verene Nicolas	Noncontroversial Essences	Get ready to role play! We'll plan to play a simple game to practice distilling the Noncontroversial Essence of someone's position. I'll bring a low-stakes scenario so we can practice this essential Convergent Facilitation skill in a relaxed and supportive setting.	5fHYp7rV-5Q	verene,nce
2022-07-27	552310	Lisa Rothman	Convergent Facilitation at home	How can we experience more harmony and happiness on a daily basis? How can we teach children to collaborate? How can we transform longstanding conflicts with our partners into dilemmas that we are motivated to solve together? Practicing Convergent Facilitaiton at home can help. Bring the situations that annoy you the most and we'll see what's possible.	H8QLqiUhPoc	lisa,at_home
2022-09-20	551760	Roni Wiener	Connecting with outliers	What can we do when someone in the group is creating challenges for us? Bring your experiences with people that frustrate you, don't make sense, or you just wish would talk less often. We'll explore how to tranform our relationships with outliers and navigate judgements that come up for us.  	aghn8eu78VA	roni,outliers
2022-10-26	551400	Verene Nicolas	Navigating Power Dynamics	Unless we attend to power differences, we are likely to miss the needs, perspectives, ideas, and concerns of the people with less power. Finding ways of inviting and integrating them leads to wiser and more robust solutions.	uJU9_YOCEG0	verene,power_differences
2022-11-16	551190	Roni Wiener and Magda Baranska	Using CF in your daily life	We get opportunities for integration every day. How do you support your family in resolving disagreements about what to do? What do you do when people at work keep arguing about the best way to finish a project? Bring your small and big decisions to explore how to apply CF and find solutions that work for everyone. 	MgWehHmr2v0	roni,magda,daily_life
2023-06-12	549110	Paul Kahawatte	Sensing into NCEs (Part 1)	Menaka used the 3 steps that Paul shared in the coaching call for breaking down NCEs inside a story she wrote. Paul and Menaka met to explore the facilitation and sensing NCEs of what's important to people in the story. 	ggCllWneWvA	paul,nce
2023-06-19	549040	Paul Kahawatte	Sensing into NCEs (Part 2)		Uo5aeU_n6R4	paul,nce
2023-07-10	548830	Paul Kahawatte	Sensing into NCEs (Part 3)		Bmmu7lMnmtY	paul,nce
2023-07-31	548620	Paul Kahawatte	Sensing into NCEs (Part 4)		ruyUkDrPdZg	paul,nce
